{"visemes":[{"end":0.45,"start":0,"viseme":"sil","weight":1},{"end":0.6,"start":0.45,"viseme":"ih","weight":1},{"end":0.65,"start":0.6,"viseme":"FF","weight":1},{"end":0.725,"start":0.65,"viseme":"DD","weight":1},{"end":0.8,"start":0.725,"viseme":"ih","weight":1},{"end":0.875,"start":0.8,"viseme":"kk","weight":1},{"end":0.975,"start":0.875,"viseme":"sil","weight":0.5},{"end":1.025,"start":0.975,"viseme":"DD","weight":1},{"end":1.225,"start":1.025,"viseme":"aa","weight":1},{"end":1.575,"start":1.225,"viseme":"FF","weight":1},{"end":1.775,"start":1.575,"viseme":"sil","weight":1}],"phonemes":"ˈivnɪŋ, lˈʌv.","gainDB":2.0245316038405434,"phonemeTrack":[{"end":0.45,"start":0,"source":"","stress":"unspecified","phoneme":"sil"},{"end":0.6,"start":0.45,"source":"ˈi","stress":"primary","phoneme":"IY"},{"end":0.65,"start":0.6,"source":"v","stress":"unspecified","phoneme":"V"},{"end":0.725,"start":0.65,"source":"n","stress":"unspecified","phoneme":"N"},{"end":0.8,"start":0.725,"source":"ɪ","stress":"unspecified","phoneme":"IH"},{"end":0.875,"start":0.8,"source":"ŋ","stress":"unspecified","phoneme":"NG"},{"end":0.975,"start":0.875,"source":"","stress":"unspecified","phoneme":"sp"},{"end":1.025,"start":0.975,"source":"l","stress":"unspecified","phoneme":"L"},{"end":1.225,"start":1.025,"source":"ˈʌ","stress":"primary","phoneme":"AH"},{"end":1.575,"start":1.225,"source":"v","stress":"unspecified","phoneme":"V"},{"end":1.775,"start":1.575,"source":"","stress":"unspecified","phoneme":"sil"}]}